{
  "businessName": "Acme Builders",
  "industry": "builder",
  "primaryGoal": "GET_LEADS",
  "description": "Quality custom home construction and remodels in the Pacific Northwest",
  "serviceAreas": ["Portland", "Beaverton", "Hillsboro"],
  "services": [
    {
      "name": "Custom Homes",
      "shortDescription": "Full custom home builds from design to completion",
      "flagship": true
    },
    {
      "name": "Remodels",
      "shortDescription": "Kitchen, bathroom, and whole-home remodels"
    },
    {
      "name": "Additions",
      "shortDescription": "Room additions and home expansions"
    }
  ],
  "projects": [
    {
      "title": "Modern Farmhouse",
      "location": "Portland, OR",
      "type": "Custom Home",
      "description": "3,200 sq ft custom home with modern farmhouse aesthetic"
    },
    {
      "title": "Kitchen Remodel",
      "location": "Beaverton, OR",
      "type": "Remodel",
      "description": "Complete kitchen renovation with custom cabinets"
    }
  ],
  "testimonials": [
    {
      "quote": "Acme Builders delivered exactly what they promised. Quality work, on time, on budget.",
      "name": "Sarah Johnson",
      "role": "Homeowner",
      "location": "Portland, OR"
    },
    {
      "quote": "Professional, reliable, and honest. Would hire again in a heartbeat.",
      "name": "Mike Chen",
      "role": "Homeowner",
      "location": "Beaverton, OR"
    }
  ],
  "contact": {
    "phone": "503-555-0123",
    "email": "info@acmebuilders.com",
    "address": "123 Construction Way, Portland, OR 97201",
    "preferredContactMethod": "all",
    "hours": "Monday-Friday: 8am-5pm"
  },
  "imagesProvided": false
}

